[
  {
    "name": "Berlin",
    "local_names": {
      "si": "බර්ලිනය",
      "ta": "பெர்லின்",
      "ia": "Berlin",
      "ja": "ベルリン",
      "el": "Βερολίνο",
      "ko": "베를린",
      "eu": "Berlin",
      "li": "Berlien",
      "sh": "Berlin",
      "cs": "Berlín",
      "mn": "Берлин",
      "fy": "Berlyn",
      "mt": "Berlin",
      "my": "ဘာလင်မြို့",
      "an": "Berlín",
      "io": "Berlin",
      "sv": "Berlin",
      "he": "ברלין",
      "sk": "Berlín",
      "ps": "برلين",
      "zh": "柏林",
      "ga": "Beirlín",
      "az": "Berlin",
      "da": "Berlin",
      "ku": "Berlîn",
      "os": "Берлин",
      "fa": "برلین",
      "su": "Berliini",
      "la": "Berolinum",
      "ty": "Berlin",
      "sc": "Berlinu",
      "br": "Berlin",
      "nn": "Berlin",
      "fi": "Berliini",
      "hu": "Berlin",
      "kn": "ಬೆರ್ಲಿನ್",
      "it": "Berlino",
      "lt": "Berlynas",
      "lv": "Berlīne",
      "qu": "Berlin",
      "ro": "Berlin",
      "ur": "برلن",
      "no": "Berlin",
      "tg": "Берлин",
      "nl": "Berlijn",
      "zu": "Berlin",
      "mr": "बर्लिन",
      "en": "Berlin",
      "pt": "Berlim",
      "es": "Berlín",
      "hr": "Berlin",
      "sq": "Berlini",
      "iu": "ᐱᕐᓖᓐ",
      "ie": "Berlin",
      "cu": "Берлинъ",
      "sw": "Berlin",
      "ar": "برلين",
      "sl": "Berlin",
      "fr": "Berlin",
      "fo": "Berlin",
      "lg": "Berlin",
      "sr": "Берлин",
      "is": "Berlín",
      "gn": "Berlin",
      "th": "เบอร์ลิน",
      "tl": "Berlin",
      "ca": "Berlín",
      "ht": "Bèlen",
      "ms": "Berlin",
      "ka": "ბერლინი",
      "ug": "Bérlin",
      "bs": "Berlin",
      "af": "Berlyn",
      "ml": "ബെര്\u200dലിന്",
      "vi": "Berlin",
      "gv": "Berleen",
      "tr": "Berlin",
      "tt": "Берлин",
      "hy": "Բեռլին",
      "be": "Берлін",
      "so": "Berlin",
      "id": "Berlin",
      "mi": "Pearīni",
      "eo": "Berlino",
      "ab": "Берлин",
      "yi": "בערלין",
      "na": "Berlin",
      "bi": "Berlin",
      "se": "Berlin",
      "am": "በርሊን",
      "te": "బెర్లిన్",
      "mk": "Берлин",
      "pl": "Berlin",
      "rm": "Berlin",
      "wo": "Berlin",
      "kv": "Берлин",
      "et": "Berliin",
      "mg": "Berlin",
      "gd": "Berlin",
      "cv": "Берлин",
      "lb": "Berlin",
      "kk": "Берлин",
      "bg": "Берлин",
      "ky": "Берлин",
      "cy": "Berlin",
      "ln": "Berlin",
      "gl": "Berlín",
      "bn": "বার্লিন",
      "de": "Berlin",
      "yo": "Berlin",
      "jv": "Berlin",
      "oc": "Berlin",
      "kw": "Berlin",
      "hi": "बर्लिन",
      "uk": "Берлін",
      "ba": "Берлин",
      "bo": "པེ་ལིང་",
      "uz": "Berlin",
      "co": "Berlinu",
      "ru": "Берлин"
    },
    "lat": 52.5170365,
    "lon": 13.3888599,
    "country": "DE"
  }
]